title,perex,date,link
Президентка Єврокомісії про ситуацію в Грузії: країна «перебуває на роздоріжжі»,"«Я з великим занепокоєнням стежу за ситуацією в Грузії і засуджую насильство на вулицях Тбілісі.», – йдеться у заяві.","23:00, 01 травня 2024",https://www.radiosvoboda.org/a/news-hruziya-protest-rozhin-yevrokomisiya/32929537.html
Уряд працює над обмеженням супутникової зйомки території України – Міноборони,"Представники Міноборони зустрілися зі працівниками «єдиної компанії», яка забезпечує щодобову фотозйомку усієї планети з роздільною здатністю 3-5 метрів","22:30, 01 травня 2024",https://www.radiosvoboda.org/a/news-uriad-suputnykova-zyomka-ukrainy/32929527.html
"Грузія: у Тбілісі силовики почали розганяти учасників мітингу, застосовують водомети","У МВС заявили, що учасники акції поводилися агресивно та намагалися пошкодити вхідні двері парламенту","22:16, 01 травня 2024",https://www.radiosvoboda.org/a/news-hruziya-protest-rozhin/32929520.html
Прокуратура: кількість постраждалих через удар Росії по Золочеву зросла до 13,"Серед поранених: шість цивільних чоловіків, шість жінок та 11-річний хлопчик","21:57, 01 травня 2024",https://www.radiosvoboda.org/a/news-prokuratura-zolochiv-poraneni/32929509.html
У Міноборони обіцяють «найближчим часом» впровадити «електронну чергу» до ТЦК,"«Я думаю, що найближчим часом зможемо розгорнути електронну чергу для відвідування ТЦК та СП. Зробимо це достатньо швидко», – cказала Катерина Черногоренко.","21:52, 01 травня 2024",https://www.radiosvoboda.org/a/news-minoborony-elektronna-cherha-ttsk/32929505.html
Іран: водії вантажівок протестують через скорочення квот на пальне,"Зменшення квот на паливо збільшило витрати операторів, у свою чергу підвищивши ціни на товари та послуги для широких верств населення","21:38, 01 травня 2024",https://www.radiosvoboda.org/a/news-iran-vodii-vantazhivky-skorochennia-kvot-palyvo/32929500.html
США ввели нові санкції проти РФ: до санкційного списку потрапила авіакомпанія «Перемога»,"Список санкцій, що включає вже більше тисячі осіб і організацій, розширився на понад 200 позицій","21:24, 01 травня 2024",https://www.radiosvoboda.org/a/news-ssha-sanktsiyi-rosiya/32929492.html
"«Застосунок запрацює 18 травня»: у Міноборони пояснили, як працюватиме е-кабінет військовозобов’язаних","Для оновлення даних в е-кабінеті військовозобов’язаного потрібно буде завантажити мобільний застосунок, авторизуватися і заповнити необхідні «поля»","20:55, 01 травня 2024",https://www.radiosvoboda.org/a/news-minoborony-e-kabinet-viyskovozobovyazani/32929478.html
Президент звільнив очільника Департаменту кібербезпеки СБУ Вітюка,Раніше Вітюка відсторонили від посади у зв’язку з перевіркою даних про спробу вручити повістку журналісту «Слідство.Інфо»,"20:50, 01 травня 2024",https://www.radiosvoboda.org/a/news-zelensky-zvilnennia-vitiuk/32929473.html
"Зеленський заявив про підготовку семи нових безпекових угод, зокрема зі США","«Наповнюємо драфти угод сильнішими можливостями для України та для нашої спільної з партнерами безпеки», – заявив Зеленський","20:35, 01 травня 2024",https://www.radiosvoboda.org/a/news-zelenskyy-bezpekovi-uhody/32929464.html
"У поліції розповіли, як збільшилася кількість вилученої зброї за час повномасштабного вторгнення",Кількість проваджень на рік на тлі повномасштабного вторгнення Росії зросла на майже 1400,"20:33, 01 травня 2024",https://www.radiosvoboda.org/a/news-politsia-nezakonnyi-obih-zbroi/32929462.html
Парламент Грузії ухвалив закон про «іноагентів» у другому читанні,"Президентка Зурабішвілі пообіцяла ветувати документ, якщо його ухвалять у третьому читанні, проте правляча партія може подолати вето","20:31, 01 травня 2024",https://www.radiosvoboda.org/a/news-parlament-hruzii-zakon-pro-inoahentiv-druhe-chytannya/32929460.html
Влада Сумщини повідомила про додаткові обмеження в прикордонних районах,Ідеться про 15 територіальних громад,"20:12, 01 травня 2024",https://www.radiosvoboda.org/a/news-sumshchyna-obmezhennya-rf/32929449.html
Центр страткомунікацій спростовує інформацію про нібито удар по штабу ЗСУ в Одесі,,"19:45, 01 травня 2024",https://www.radiosvoboda.org/a/news-odesa-udar-sprostuvannya/32929434.html
Генштаб повідомив про 100 бойових зіткнень на фронті,"За повідомленням, найбільше атак – 33 – було на Авдіївському напрямку","19:40, 01 травня 2024",https://www.radiosvoboda.org/a/news-henshtab-zvedennia/32929433.html
США та їхні союзники тиснуть на ОАЕ через торгівлю з Росією та санкції – Reuters,"Американські, британські та європейські чиновники відвідали ОАЕ минулого тижня","19:05, 01 травня 2024",https://www.radiosvoboda.org/a/news-oae-tysk-zakhid-sanktsiyi/32929406.html
«Безпрецедентна статистика». У поліції заявили про значне зростання випадків ДТП із нетверезими водіями,«Вже за чотири місяці цього року ми маємо знову ж таки безпрецедентну статистику: зафіксували вже майже 50 тисяч випадків керування автомобілем у стані сп’яніння»,"19:01, 01 травня 2024",https://www.radiosvoboda.org/a/news-dtp-netverezi-vodii/32929403.html
ЗМІ: у Словаччині надали захист соратнику Медведчука,"У МВС Словаччини не підтвердили та не спростували повідомлення про надання Артему Марчевському, соратнику Віктора Медведчука, статусу тимчасового захисту.","18:39, 01 травня 2024",https://www.radiosvoboda.org/a/news-slovachchyna-zakhyst-soratnyk-medvedchuka/32929387.html
"«Циркон», «Онікс», «Калібр» і Х-69: в ГУР назвали кількість ракет у Росії","Російські військові регулярно з різних видів озброєння – ударними БПЛА, ракетами, КАБами, РСЗВ – атакують українські регіони","18:31, 01 травня 2024",https://www.radiosvoboda.org/a/news-hur-rosia-rakety/32929381.html
"Президент «Енергоатому» так і не задекларував будинок тещі, де мешкає, хоча обіцяв – «Схеми»","Раніше журналісти виявили, що теща президента «Енергоатому» влітку 2023-го року придбала будинок і землю під Києвом вартістю близько 7 млн грн, і там оселився сам держпосадовець з родиною","18:16, 01 травня 2024",https://www.radiosvoboda.org/a/news-skhemy-prezydent-enerhoatomu-ne-zadeklaruvav-budynok/32929360.html
Мінекономіки: у квітні Україна досягла рекордного обсягу експорту з лютого 2022 року,"Експорт у квітні сягнув 3,3 млрд доларів","17:58, 01 травня 2024",https://www.radiosvoboda.org/a/news-minekonomiky-rekord-eksport/32929357.html
67-річна жінка загинула через обстріл на Харківщині – ОВА,"«На жаль, 67-річна жителька, яка отримала поранення внаслідок обстрілів, померла в лікарні»","17:51, 01 травня 2024",https://www.radiosvoboda.org/a/news-kharkivshchyna-zahybla/32929350.html
Поліція Стамбула затримала понад 210 протестувальників під час акції 1 травня,Влада заборонила мітинги 1 травня на центральній площі Стамбула,"17:30, 01 травня 2024",https://www.radiosvoboda.org/a/news-stambul-zatrymannya-politsiya/32929328.html
У Туркменистані чиновників зобов’язали купувати годинники із зображенням Бердимухамедових,"За словами джерела Радіо Азатлик, дешевші екземпляри зобов’язали купувати начальників дрібних бюджетних організацій, а дорожчі годинники мають придбати керівники вищої чиновницької ланки області","17:29, 01 травня 2024",https://www.radiosvoboda.org/a/news-turkmenystan-hodynnyky-berdymukhamedov/32929326.html
Росія назвала резолюцію ООН щодо масових вбивств у Сребрениці «однобокою»,"Виступаючи на засіданні 30 квітня, постійний представник Росії в ООН Василь Небензя назвав проєкт документу «однобоким», «політично зарядженим», таким, що не сприяє «міжнаціональному примиренню в Боснії і Герцеговині»","17:03, 01 травня 2024",https://www.radiosvoboda.org/a/news-oon-srebrenytsia-rezoliutsia-rosia/32929310.html
МВС: зросло число постраждалих через обстріл Золочева на Харківщині,Раніше повідомлялося про двох загиблих та шістьох постраждалих,"16:54, 01 травня 2024",https://www.radiosvoboda.org/a/news-zolochiv-postrazhdali-mvs/32929303.html
ОВА: війська РФ обстріляли Гірник на Донеччині з реактивної артилерії – є загиблі і поранені,РФ атакувала місто Гірник з реактивної системи залпового вогню «Ураган»,"16:53, 01 травня 2024",https://www.radiosvoboda.org/a/news-urahan-hirnyk-obstril/32929302.html
Голова МЗС Латвії: деякі партнери дають Україні зброю без вимоги уникати ударів по Росії,"«Вже зараз є країни, які надали Україні зброю без подібних обмежень»","16:40, 01 травня 2024",https://www.radiosvoboda.org/a/news-mzs-latvii-ukraina-udary-po-rf/32929292.html
Лідери країн Балтії закликали розпочати переговори про вступ України до ЄС,"«Ми закликаємо скликати міжурядові конференції з Україною та Молдовою та розпочати переговори про вступ у червні 2024 року», – йдеться у заяві","16:33, 01 травня 2024",https://www.radiosvoboda.org/a/news-baltiya-perehovory-yes-vstup-ukrayina/32929286.html
Франція і Японія почнуть переговори щодо взаємного доступу військ – ЗМІ,У грудні 2023 року Японія оголосила про найбільше нарощування військового потенціалу з часів Другої світової війни,"22:59, 02 травня 2024",https://www.radiosvoboda.org/a/news-frantsiya-yaponiya-dostup-viys%CA%B9k/32931032.html
Українська влада повідомляє про вибухи в Бердянську та Маріуполі,"«Мешканці Бердянська чули вибух, після чого вогонь розгорівся  локаційно в мікрорайоні Колонія», заявила голова міської військової адміністрації","22:51, 02 травня 2024",https://www.radiosvoboda.org/a/news-vybuhy-berdyansk-mariupol/32931030.html
"Командувач армії Фінляндії: Росія навряд нападатиме на НАТО в найближчі роки, але може продовжити гібридні атаки","«Звичайно, перевірка статті 5 завжди можлива, але якщо ми вживемо правильних дій і збережемо єдність, я вважаю напад малоймовірним», – сказав Янне Яаккола","22:21, 02 травня 2024",https://www.radiosvoboda.org/a/news-komanduvach-armiyi-finlyandiyi-rosiya-napad-nato/32931016.html
Парламент Сербії затвердив новий склад уряду. В його складі – двоє політиків під санкціями США,Сполучені Штати раніше висловили «розчарування» через включення підсанкційних осіб до нового уряду Сербії,"22:12, 02 травня 2024",https://www.radiosvoboda.org/a/news-parlament-serbii-novyi-uriad/32931014.html
Білий дім: КНДР отримала від Росії значні обсяги нафти,"Вашингтон вважає, що ці обсяги перевищують ліміт, встановлений санкціями ООН","21:43, 02 травня 2024",https://www.radiosvoboda.org/a/news-kndr-rosiya-nafta/32931002.html
Міноборони Росії знову заявляє про атаку безпілотників на Крим,"Як стверджує російське відомство, над територією півострова нібито збили два безпілотника","21:26, 02 травня 2024",https://www.radiosvoboda.org/a/news-minoborony-rosii-bezpilotnyky-krym/32930998.html
"Сили РФ з «Градів» обстріляли село на Донеччині, серед загиблих є дитина – влада","За даними місцевої влади, сьогодні ввечері російські війська обстріляли село Мемрик із «Градів»","21:16, 02 травня 2024",https://www.radiosvoboda.org/a/news-obstril-donechchyni-dytyna-zahybli/32930979.html
НАТО заявляє про посилення російських гібридних атак на території членів Альянсу,"«Ми засуджуємо поведінку Росії й закликаємо РФ дотримуватися своїх міжнародних зобов’язань, як це роблять члени Альянсу. Дії Росії не стримають членів Альянсу від продовження підтримки України»","21:02, 02 травня 2024",https://www.radiosvoboda.org/a/news-nato-rosia/32930981.html
Синєгубов: через російський обстріл села в Куп’янському районі загинув цивільний,«На території приватного домоволодіння загинув 66-річний чоловік»,"21:01, 02 травня 2024",https://www.radiosvoboda.org/a/news-syniehubov-rosiiskyi-obstril-zahublyi/32930980.html
У Казахстані журналістку судять за підтримку місцевої служби Радіо Свобода,"Звинувачення пов’язане зі статтею, в якій журналістка згадувала про проблеми Радіо Азаттик під час отримання офіційної акредитації від МЗС","20:48, 02 травня 2024",https://www.radiosvoboda.org/a/news-kazahstan-sud-maricheva/32930972.html
«Оперативність важлива» – Зеленський про оголошені партнерами пакети допомоги Україні,"«Оперативність важлива. Зміст пакетів є, я на сьогодні не бачу проблем із цим», – сказав Володимир Зеленський у своєму відеозверненні.","20:44, 02 травня 2024",https://www.radiosvoboda.org/a/news-zelenskyy-viyskova-dopomoha-operatyvnist/32930969.html
У США поки не бачать готовності Китаю працювати для досягнення миру в Україні – Білий дім,"За словами Джона Кірбі, він «неправильно сказав би, якби говорив, що ми дійсно бачили, як Китай рухається в цьому напрямку – ми такого не бачили»","20:39, 02 травня 2024",https://www.radiosvoboda.org/a/news-ssha-kytai-ukraina/32930966.html
ОВА: через російський обстріл Херсонщини поранена людина,У момент російського удару 46-річний чоловік перебував на подвір’ї,"20:10, 02 травня 2024",https://www.radiosvoboda.org/a/news-khersonshchyna-obstril-poranenyy/32930942.html
"Генштаб: на фронті за добу було 106 зіткнень, найбільше – на Авдіївському і Бахмутському напрямках","Українські військові відбивали атаки російських сил на сімох напрямках, заявили у Генштабі","19:54, 02 травня 2024",https://www.radiosvoboda.org/a/news-henshtab-front/32930927.html
У Кривому Розі повідомляли про звуки вибухів. Влада каже про роботу ППО на Дніпропетровщині,"За даними влади, сили ППО збили безпілотник над Криворізьким районом","19:36, 02 травня 2024",https://www.radiosvoboda.org/a/news-ppo-dnipropetrovshchyna/32930913.html
Опубліковані супутникові знімки наслідків ударів по військовому аеродрому в Джанкої,"Судячи з супутникових фото, удар зазнала одна з установок С-300/С-400","19:27, 02 травня 2024",https://www.radiosvoboda.org/a/news-dzankoj-udar-krym/32930873.html
"Удар РФ по Дергачах: було два влучання, більшість постраждалих дітей були на занятті у спортклубі",,"19:12, 02 травня 2024",https://www.radiosvoboda.org/a/news-derhachi-udar-naslidky/32930887.html
"Угорщина: в Будапешті через ножові поранення помер українець, підозрюваного затримали","Чоловік зазнав серйозних поранень, він помер на місці","18:49, 02 травня 2024",https://www.radiosvoboda.org/a/news-budapesht-vbyvstvo-ukrayinets/32930867.html
Війна в Україні навряд чи закінчиться найближчим часом – розвідка США,"«Ця агресивна тактика (РФ – ред.), ймовірно, триватиме, і війна навряд чи закінчиться найближчим часом»","18:31, 02 травня 2024",https://www.radiosvoboda.org/a/news-viyna-ukraina-rozvidka-ssha/32930847.html
"У Киргизстані вантажівка в’їхала в групу дітей, десятки постраждали, троє – у тяжкому стані","За даними МВС, 48-річний водій залишив свою машину, з якої дітям планували роздавати морозиво, без нагляду, вона з’їхала з гори і врізалася в групу з сотень людей, більшість з яких були дітьми","18:00, 02 травня 2024",https://www.radiosvoboda.org/a/news-kyrhyzstan-dtp-dity/32930827.html
ОВА: у Дергачах на Харківщині зросло число постраждалих через російський удар дітей,Раніше повідомлялось про шестеро постраждалих дітей,"17:55, 02 травня 2024",https://www.radiosvoboda.org/a/news-derhachi-udar-kaby/32930818.html
Відбудова розбомблених будинків у Секторі Гази може тривати десятки років – ООН,"За оцінками, опублікованими Програмою розвитку ООН, Сектору Гази потрібно буде «приблизно 80 років для відновлення всіх повністю зруйнованих житлових одиниць». Однак, за найкращим сценарієм, це може бути зроблено до 2040 року","17:41, 02 травня 2024",https://www.radiosvoboda.org/a/news-oon-gaza-ruinuvannia/32930806.html
Зеленський про засідання Ставки: обговорювали готовність фортифікаційних рубежів і графіки надходження зброї від партнерів,На засіданні Ставки був оголошений великий звіт щодо ступеня готовності фортифікаційних рубежів у прикордонних регіонах та на напрямках активних бойових дій,"17:30, 02 травня 2024",https://www.radiosvoboda.org/a/news-zelenskyy-stavka-zasidannya/32930796.html
"Підприємець українського походження проїде 7 тисяч км велосипедом, щоб зібрати кошти для постраждалих від війни дітей","Приблизно за два тижні він стартує з Тайваню і загалом проїде три континенти – Азію, Америку і Європу","17:13, 02 травня 2024",https://www.radiosvoboda.org/a/news-velomarafon-dity-viyna/32930763.html
ЗМІ: Шольц і Макрон проведуть таємну зустріч в Парижі напередодні візиту Сі,"Як повідомляється, ключовою темою обговорення політиків стане візит Сі Цзіньпіна","17:02, 02 травня 2024",https://www.radiosvoboda.org/a/news-scholz-and-macron-zustrich-paryzh-si/32930748.html
Унаслідок обстрілу РФ Дергачів на Харківщині поранено шістьох дітей – влада,"«Двоє з дітей отримали легкі поранення кінцівок, четверо – середньої тяжкості. Усі потерпілі госпіталізовані»","16:52, 02 травня 2024",https://www.radiosvoboda.org/a/news-derhachi-obstril-dity/32930734.html
