title,perex,date,link
Прокуратура вимагає заборонити у Болгарії дві проросійські воєнізовані організації,Організації БНО «Шипка» та «Військовий союз імені Василя Левського» пов’язані між собою та відомі своєю проросійською орієнтацією,"22:53, 22 травня 2024",https://www.radiosvoboda.org/a/news-bolhariya-prorosiys%CA%B9ki-orhanizatsiyi/32959645.html
Зеленський має намір взяти участь в урочистостях в Нормандії – Politico,"Як зауважує видання, плани Зеленського особливо примітні, оскільки нещодавно він скасував закордонні поїздки після початку великого наступу Росії на Харківщині","22:48, 22 травня 2024",https://www.radiosvoboda.org/a/news-zelenskyy-urochystosti-normandiya/32959642.html
Німеччина готова використовувати доходи від заморожених російських активів – ЗМІ,"«Якщо існує юридично життєздатний механізм, який дозволить нам краще використовувати ці фінансові потоки, то ми готові це зробити» – заявило джерело","22:19, 22 травня 2024",https://www.radiosvoboda.org/a/news-nimechchyna-aktyvy-rf-zamorozheni-vykorystannya/32959626.html
Міноборони: вже 805 тисяч громадян оновили військово-облікові дані у застосунку «Резерв+»,18 травня Міністерство оборони запустило мобільний застосунок «Резерв+»,"22:12, 22 травня 2024",https://www.radiosvoboda.org/a/32959625.html
«Російська провокація»: Український дім у Варшаві розмалювали провокативними написами,"В Українському домі вважають, що це російська провокація, мета якої розпалити конфлікт в українській спільноті","21:53, 22 травня 2024",https://www.radiosvoboda.org/a/news-varshava-ukrayins%CA%B9kyy-dim-napysy/32959618.html
"Генштаб ЗСУ: сили РФ продовжують атаки на майже всій лінії фронту, біля 10 населених пунктів тривають бої",Найбільше боєзіткнень на цей час відбулося на Куп’янському напрямку,"21:49, 22 травня 2024",https://www.radiosvoboda.org/a/news-henshtab-front-viyna-ataky-rf/32959616.html
САП підтвердила обшуки у детектива НАБУ,У НАБУ наразі ці слідчі дії не коментували,"21:14, 22 травня 2024",https://www.radiosvoboda.org/a/news-sap-obshuky-detektyv-nabu/32959606.html
"Костін: ідентифіковано 357 військових РФ та колаборантів, які підозрюються у воєнних злочинах","За його словами, їх підозрюють у вчиненні умисних вбивств, катуванні та жорстокому поводженні з цивільними та військовополоненими","20:47, 22 травня 2024",https://www.radiosvoboda.org/a/news-kostin-voyenni-zlochyny/32959593.html
На Рівненщині «вагнерівця» із Білорусі засудили до 15 років за ґратами у справі про готування диверсії,"За версією слідства, фігуранта справи було завербовано російським ГРУ для здійснення диверсії на обʼєкті енергетичної інфраструктури в Рівненській області","20:45, 22 травня 2024",https://www.radiosvoboda.org/a/news-rivnenska-oblast-hotuvannja-dyversiji-vagnerivec/32959590.html
"Зеленський розповів про спецнараду, на якій обговорювалася протидія російським авіабомбам","«Альтернатив не може бути – Україні потрібні системи й тактики, які дадуть змогу захищати наші позиції, наші міста й громади від цих бомб»","20:39, 22 травня 2024",https://www.radiosvoboda.org/a/news-zelenskyy-narada-protydiya-kaby/32959587.html
Дострокові вибори до Палати громад парламенту Британії відбудуться 4 липня,"Відповідно до законодавства, вибори мали відбутися не пізніше січня 2025 року. В уряді довго обговорювали, на яку дату їх призначити","20:10, 22 травня 2024",https://www.radiosvoboda.org/a/news-dostrokovi-vybory-brytanija/32959555.html
Застосування графіків відключень світла можливе протягом всієї доби 23 травня – «Укренерго»,«Причина подовження терміну дії обмежень – прогнозована щільна хмарність у більшості регіонів України»,"20:02, 22 травня 2024",https://www.radiosvoboda.org/a/news-ukrenerho-vidklyuchennya-svitla/32959543.html
«Швидкісна ціль у північному напрямку» – в більшості регіонів України оголошена повітряна тривога (відбій),"Російські військові регулярно з різних видів озброєння – ударними БПЛА, ракетами, КАБами, РСЗВ – атакують українські регіони","19:54, 22 травня 2024",https://www.radiosvoboda.org/a/news-tryvoha-shvydkisna-cil/32959537.html
Спікер Палати представників Джонсон підтримав дозвіл Україні бити по РФ американською зброєю,"Раніше цього тижня очільник Пентагону Ллойд Остін на пресконференції за підсумками засідання Контактної групи з питань оборони України висловив очікування, що Україна не буде застосовувати зброю за межами країни","19:38, 22 травня 2024",https://www.radiosvoboda.org/a/news-spiker-dzhonson-pidtrymav-dozvil-ukrajini-byty-po-rf-zbrojeju-ssha/32959524.html
Президент Чилі у розмові із Зеленським підтвердив участь у Глобальному саміті миру,"«Обговорили ситуацію на Харківщині, де Росія намагається розширити географію свого вторгнення»","19:31, 22 травня 2024",https://www.radiosvoboda.org/a/news-prezydent-chyli-samit-myru/32959514.html
"Студенти МДУ вимагають зняти з будівлі вишу дошку прихильнику фашизму Ільїну, якого цитує Путін",На початку квітня 2024 року студенти Російського державного гуманітарного університету запустили петицію проти створення у виші Вищої політичної школи імені Івана Ільїна,"19:08, 22 травня 2024",https://www.radiosvoboda.org/a/news-mdu-memorialna-doshka-pryhylnyku-fashyzmu-iljin-putin/32959496.html
Кількість постраждалих унаслідок обстрілу Харкова зросла до 12 – прокуратура,«З пораненням до лікарні доставлено 16-річного хлопця»,"19:00, 22 травня 2024",https://www.radiosvoboda.org/a/news-kharkiv-obstril-postrazhdali/32959488.html
«Меморіал» визнав політвʼязнем башкирського активіста Фаїля Алсинова,Алсинов відомий своєю відкритою критикою підтримуваного Кремлем глави Башкортостану Радія Хабірова та його уряду,"18:38, 22 травня 2024",https://www.radiosvoboda.org/a/news-memorial-politvjazen-bashkyrskyj-aktyvist-alsynov/32959473.html
Грищук: у школах вивчатимуть предмет «захист України» – ВР ухвалила відповідний закон,"«Захист України» мають вивчати всі учні, так само як математику чи українську мову»","18:23, 22 травня 2024",https://www.radiosvoboda.org/a/news-zakhyst-ukrayiny-hryshchuk/32959457.html
У Тегерані триває церемонія прощання з президентом Раїсі,"23 травня тіло Раїсі доставлять до мавзолею імама Рези в місті Мешхед, де із загиблим президентом попрощається верховний лідер Ірану аятола Хаменеї","18:11, 22 травня 2024",https://www.radiosvoboda.org/a/news-tegeran-proshchannja-z-prezydentom-rajisi/32959445.html
"Генштаб повідомляє про напружену ситуацію на Куп’янському напрямку, там відбулося 22 боєзіткнення",На Покровському напрямку тривають 12 бойових зіткнень,"17:40, 22 травня 2024",https://www.radiosvoboda.org/a/news-henshtab-sytuatsiya-na-fronti/32959409.html
За корабель або літак – 5 днів до відпустки: уряд затвердив порядок заохочення за знищену техніку РФ,"Підтвердженням знищеної техніки мають бути записи в журналах бойових дій, рапорт командира та відеозапис","17:38, 22 травня 2024",https://www.radiosvoboda.org/a/news-vidpustka-za-znyshchenu-tehniku-rf/32959398.html
"У Вовчанську війська РФ атакували дроном авто під час евакуації, загинув поліцейський – Клименко","Унаслідок удару один поліцейський загинув, ще один поранений","17:08, 22 травня 2024",https://www.radiosvoboda.org/a/news-avtomobil-politsiyi-dron-vovchansk/32959366.html
Окупаційна «адміністрація ЗАЕС» звинуватила ЗСУ в повітряній атаці атомної станції,Українські військові наразі не коментували ці повідомлення,"17:06, 22 травня 2024",https://www.radiosvoboda.org/a/news-zaes-povitryana-ataka/32959368.html
Мінекономіки повідомляє про підписання рамкової угоди для втілення Ukraine Facility,"Згідно з угодою, Україна зобов’язується забезпечити високу прозорість та контроль у використанні коштів, наданих Євросоюзом","16:54, 22 травня 2024",https://www.radiosvoboda.org/a/news-minekonimiky-ramkova-uhoda-ukraine-facility/32959356.html
НАБУ підозрює ексазтупника голови Офісу президента у незаконному збагаченні на понад 15 млн грн,Андрій Смирнов підтвердив журналістам вручення йому підозри,"16:39, 22 травня 2024",https://www.radiosvoboda.org/a/news-smyrnov-pidozra-nezakonne-zbahachennya/32959330.html
ООН зупинила роздавання продуктів у місті Рафах у Секторі Гази,"6 травня Ізраїль розпочав наземну операцію у місті Рафах на півдні Смуги Гази, на кордоні з Єгиптом. Ізраїль називає Рафах останнім оплотом «Хамасу», радикального ісламістського угруповання, визнаного терористичним у США та Євросоюзі","16:26, 22 травня 2024",https://www.radiosvoboda.org/a/news-oon-produkty-rafah/32959311.html
У Харкові пролунали вибухи – влада,,"23:14, 23 травня 2024",https://www.radiosvoboda.org/a/news-kharkiv-vybukhy/32961220.html
У Лондоні затримали підозрюваного у сприянні російській розвідці,"Подробиць про те, якою незаконною діяльністю займався Говард Майкл Філліпс, слідство поки не наводить","23:05, 23 травня 2024",https://www.radiosvoboda.org/a/news-london-zatrymannya-rozvidka-rf/32961219.html
"Війська РФ атакували з дрона село на Харківщині, постраждала дитина – ОВА",Від вибуху дрона постраждав 11-річний хлопчик,"23:00, 23 травня 2024",https://www.radiosvoboda.org/a/news-udar-dron-postrazhdala-dytyna/32961217.html
В окупованому Криму повідомляють про звуки вибухів в низці населених пунктів,,"22:35, 23 травня 2024",https://www.radiosvoboda.org/a/news-krym-vybukhy/32961202.html
"Попри критику правозахисників ВР ухвалила за основу законопроєкт, який обмежує доступ до судових рішень",Раніше більше 30 громадських організацій закликали Верховну Раду не ухвалювати законопроєкт  № 7033-д,"22:34, 23 травня 2024",https://www.radiosvoboda.org/a/news-zakon-dostup-do-sudovykh-rishen/32961199.html
Генштаб ЗСУ: на Харківщині сили РФ чотири рази намагалися просунутись вперед – отримують відсіч,Тривають бої в районах сіл Стариця і Тихе,"22:01, 23 травня 2024",https://www.radiosvoboda.org/a/news-shtab-sytuatsiya-na-fronti-viyna/32961187.html
"У лікарні померла 4-річна дитина, яка постраждала через російський обстріл Одеси 29 квітня – влада","«Сьогодні у лікарні померла 4-річна Злата, осколок російської ракети влучив у серце дитини. Наші медики боролися до останнього…»","21:30, 23 травня 2024",https://www.radiosvoboda.org/a/news-odesa-dytyna-zahybel-udar-rf/32961173.html
Зеленський: Україна і Норвегія підпишуть безпекову угоду за першої нагоди,"Зеленський також зазначив, що прем’єр-міністр підтвердив участь Норвегії в Саміті миру у Швейцарії","21:27, 23 травня 2024",https://www.radiosvoboda.org/a/news-ukrayina-norvehiya-bezpekova-uhoda/32961170.html
Пекін відреагував на звинувачення Британії щодо надання зброї Росії,"Речник МЗС Китаю сказав, що «Великобританія, а не Китай, роздуває полум'я навколо України»","21:18, 23 травня 2024",https://www.radiosvoboda.org/a/news-pekin-brytaniya-rf-nadannya-zbroyi/32961162.html
ДТП на блокпосту у Києві: суддя Тандир залишиться під вартою до 21 липня – прокуратура,Ухвалою суду запобіжний захід у вигляді тримання під вартою без визначення застави продовжено на 2 місяці,"21:02, 23 травня 2024",https://www.radiosvoboda.org/a/news-sud-tandyr-pid-vartoyu/32961158.html
Україні вдалося повернути ще 13 дітей – Лубінець,"За офіційними даними української влади, з 24 лютого 2022 року з України до Росії депортували близько 20 тисяч дітей","20:53, 23 травня 2024",https://www.radiosvoboda.org/a/news-ukrajini-vdalosja-povernuty-13-ditej-lubinec/32961149.html
У РФ заочно засудили економіста Соніна – за пости про Бучу та Маріуполь,Костянтин Сонін назвав звинувачення на свою адресу «абсолютно брехливим»,"20:40, 23 травня 2024",https://www.radiosvoboda.org/a/news-rf-zaochno-zasudyly-ekonomista-sonina-bucha-mariupol/32961141.html
«Питання політичне»: голова профільного комітету ВР про удари по Росії західною зброєю,"Він пояснив, що у міжнародно-правовому вимірі Україна має «невід’ємне» право на самооборону, а територія держави-агресора є «територією театру воєнних дій»","20:35, 23 травня 2024",https://www.radiosvoboda.org/a/news-merezhko-udary-po-rosiyi/32961133.html
110-та ОМБр: на Донеччині українські військові збили ще один російський Су-25,«Сьогодні нестримні зенітники 110 ОМБр снайперськи відпрацювали по іще одному Су. Це два»,"20:22, 23 травня 2024",https://www.radiosvoboda.org/a/news-su-25-zbyttya-donbas-110-bryhada/32961118.html
В ООН схвалили заснування дня памʼяті про геноцид у Сребрениці,"У Боснії та Герцеговині законодавчо заборонено заперечувати геноцид у Сребрениці. Попри це, у квітні 2024 року парламент Республіки Сербської затвердив доповідь, яка заперечує геноцид","20:16, 23 травня 2024",https://www.radiosvoboda.org/a/news-oon-den-pamjati-genocydu-v-srebrenyci/32961114.html
"Війська РФ хочуть відтягнути сили ЗСУ на північ, щоб просунутися на сході – Зеленський",«Окрім планів РФ на полі бою розвідники отримали багато даних щодо стратегії зриву Саміту миру»,"20:06, 23 травня 2024",https://www.radiosvoboda.org/a/news-zelenskyy-stavka-kharkiv/32961103.html
«Безпечних місць у Харківській області практично не залишається» – речниця ОВА,"«Харків і Харківська область завжди під ризиком ударів, оскільки ми знаходимося за 30 кілометрів від кордону з РФ»","19:33, 23 травня 2024",https://www.radiosvoboda.org/a/news-kharkiv-shapoval-obstrily/32961061.html
"Чехи менше підтримують членство України в ЄС, ніж угорці – опитування","Середній показник по країнах ЄС у підтримці України на шляху до ЄС – 60%, стільки ж європейського населення підтримує і надання зброї Україні","19:27, 23 травня 2024",https://www.radiosvoboda.org/a/news-ukrajina-es-chlenstvo-opytuvannja/32961052.html
«Укренерго» попереджає про можливі відключення світла протягом всієї доби 24 травня,«Причина – дощова погода та щільна хмарність у більшості регіонів України»,"19:11, 23 травня 2024",https://www.radiosvoboda.org/a/news-ukrenerho-vidklyuchennya-svitla/32961028.html
У Львові відбувся Форум російської опозиції на підтримку України,На форумі було понад 40 учасників від провідних опозиційних обʼєднань – Марат Гельман,"19:00, 23 травня 2024",https://www.radiosvoboda.org/a/news-lviv-forum-rosijskoji-opozyciji/32961009.html
ЄС закликає Росію звільнити з полону цивільних українців і пустити до них Червоний Хрест – заява,"ЄС закликає Росію надати списки імен і місцеперебування всіх українців, позбавлених волі","18:51, 23 травня 2024",https://www.radiosvoboda.org/a/news-rosiya-tsyvilni-poloneni/32961000.html
"Сили РФ здійснили понад пів сотні атак, найбільше – на Куп’янському та Покровському напрямках – Генштаб","Також активними сили РФ є на Краматорському напрямку, де тривають три бойові зіткнення","18:22, 23 травня 2024",https://www.radiosvoboda.org/a/news-genshtab-zvedennya/32960971.html
США готують новий пакет військової допомоги для України на 275 мільйонів доларів – AP,"За даними видання, до пакету допомоги увійдуть боєприпаси 155 міліметрів і ракети для HIMARS","18:00, 23 травня 2024",https://www.radiosvoboda.org/a/news-ssha-viyskova-dopomoha-ukrayina/32960945.html
Литва забороняє імпорт майже трьох тисяч видів аграрної продукції з Білорусі та РФ,"У березні Литва разом з Латвією, Естонією, Польщею та Чехією закликали Єврокомісію проаналізувати можливість обмеження імпорту до ЄС харчових продуктів із Білорусі та Росії","17:48, 23 травня 2024",https://www.radiosvoboda.org/a/news-lytva-zaborona-exportu-agrarnoji-produkciji-z-bilorusi/32960935.html
15 років за ґратами за коригування удару по Яворівському полігону отримав житель Львова,"13 березня 2022 року російські війська завдали по Яворівському полігону удару 30 крилатими ракетами, внаслідок чого понад 60 людей загинули, ще понад 160 зазнали поранень різного ступеня тяжкості","17:20, 23 травня 2024",https://www.radiosvoboda.org/a/news-15-rokiv-za-gratamy-koryguvannja-udaru-po-javorivskomu-polihonu/32960906.html
ЄСПЛ вважає справедливими судові рішення щодо Саакашвілі у Грузії,"ЄСПЛ відмовив Саакашвілі в задоволенні скарги, вважаючи, що колишній президент не надав достатніх доказів несправедливості судових рішень","17:11, 23 травня 2024",https://www.radiosvoboda.org/a/news-yespl-saakashvili-sud-hruziya/32960890.html
Путін дозволив використати майно США в РФ для компенсації збитків від вилучення російських активів,"Створена російським урядом спеціальна комісія виявлятиме майно, що належить юридичним особам США, яке може бути використане для компенсації збитків","16:55, 23 травня 2024",https://www.radiosvoboda.org/a/news-putin-majno-ssha-v-rf-dlja-kompensaciji-sankcij/32960859.html
"Сили РФ завдали удару по селищу Золочів, постраждало двоє жінок – прокуратура","«Попередньо, росіяни атакували населений пункт авіаційним боєприпасом»","16:33, 23 травня 2024",https://www.radiosvoboda.org/a/news-kharkivshchyna-zolochiv-rosiya-obstril-viyna/32960825.html
