title,perex,date,link
Генштаб: на Харківському напрямку бої точаться в районах Липців та Вовчанська,Протягом поточної доби відбулося 87 бойових зіткнень,"20:54, 16 травня 2024",https://www.radiosvoboda.org/a/news-henshtab-sytuatsiya-na-fronti/32950510.html
"Немає навичок і можливостей – у НАТО пояснили, чому Росія не здатна на стратегічний прорив","«Тепер у них більше військ, але їхня якість нижча, ніж тих, з якими вони почали конфлікт»","20:44, 16 травня 2024",https://www.radiosvoboda.org/a/news-nato-rosia-yakist-viysk/32950503.html
Посадовець Кабміну не задекларував майно в Дубаї на $331 000 – «Схеми»,Дружина урядовця придбала один із найбільших номерів у готелі Wyndham Dubai Marina у 2018 році,"20:30, 16 травня 2024",https://www.radiosvoboda.org/a/news-skhemy-posadovets-kabmin-mayno-dubay/32950379.html
В «Укренерго» повідомили про графіки відключень електроенергії на 17 травня,"«Потужностей українських електростанцій недостатньо через наслідки п’яти ракетно-дронових атак, здійснених Росією по українській енергосистемі з 22 березня»","20:25, 16 травня 2024",https://www.radiosvoboda.org/a/news-ukrenerho-vidkliuchennia/32950492.html
«Крок у відповідь»: МЗС РФ оголосило британського військового аташе персоною нон ґрата,Адріану Когхіллу наказали покинути територію країни протягом тижня,"20:23, 16 травня 2024",https://www.radiosvoboda.org/a/news-rosiya-ukrayina-persona-non-hrata/32950488.html
Прикордонники з 18 травня перевірятимуть військово-облікові документи на пунктах пропуску,"Громадяни, які мають право на виїзд за кордон, мають мати при собі документи про звільнення від мобілізації або зняття з військового обліку","20:12, 16 травня 2024",https://www.radiosvoboda.org/a/news-dpsu-viiskovo-oblikovi-dokumenty-punkty-propusku/32950479.html
Австрія створює фонд з підтримки інвестицій до України – Мінфін країни,Протягом наступних 5 років буде виділено 500 мільйонів євро на підтримку компаній та розвиток нового бізнесу в Україні.,"19:51, 16 травня 2024",https://www.radiosvoboda.org/a/news-avstriya-investytsiyi-ukrayina/32950458.html
Зеленський закликав Польщу спільно протидіяти атакам Росії на газову інфраструктуру на заході України,«Одна із цілей РФ зараз – газова інфраструктура на заході України. Успіх Росії там поставить під удар енергетичну безпеку Європи»,"19:33, 16 травня 2024",https://www.radiosvoboda.org/a/news-zelensky-polshcha-ataky-rosii-hazova-infrastruktura/32950437.html
США запровадили санкції проти громадян і компаній РФ за допомогу в поставці зброї із КНДР,"Санкції спрямовані на припинення обміну зброєю між КНДР та Росією, включаючи передачу ракет з КНДР для використання Росією проти України","19:21, 16 травня 2024",https://www.radiosvoboda.org/a/news-sanktsiyi-rosiya-rakety-kndr/32950421.html
"Підозрюваний у вбивстві син судді ОАСК Іван Аблов досі на свободі, йому не обрали запобіжний захід – «Схеми»","Термін запобіжного заходу Івана Аблова сплив ще 26 квітня, у нього немає процесуальних обов’язків","18:55, 16 травня 2024",https://www.radiosvoboda.org/a/news-skhemy-ivanu-ablovu-ne-obraly-zapobizhnyy-zakhid/32950274.html
Влада Херсона повідомляє про ще одного пораненого через російський обстріл,«До однієї з херсонських лікарень доправлено чоловіка 1972 р.н. з попереднім діагнозом – мінно-вибухова травма»,"18:37, 16 травня 2024",https://www.radiosvoboda.org/a/news-kherson-poranenyi-rosiiskyi-obstril/32950381.html
Молдовський бізнесмен-утікач Шор отрмав російське громадянство – влада,"Шор, який заснував проросійську партію «Шор», втік з країни у 2019 році","18:33, 16 травня 2024",https://www.radiosvoboda.org/a/news-shor-moldova-rosiyske-hromadyanstvo/32950378.html
Генштаб повідомляє про «найбільшу активність» армії Росії на Покровському напрямку протягом доби,"Протягом дня командування зафіксувало 79 бойових зіткнень. Зокрема, триває протистояння Сил оборони російському наступу на Харківщині","18:11, 16 травня 2024",https://www.radiosvoboda.org/a/news-henshtab-aktyvnict-armii-rosii-pokrovskyi-napriamok/32950347.html
"Російська армія обстріляла Херсон з лівого берега, поранено жінку – влада","«Внаслідок цієї ворожої атаки контузію, вибухову та закриту черепно-мозкову травми отримала 54-річна жінка»","17:50, 16 травня 2024",https://www.radiosvoboda.org/a/news-kherson-obstril-livyy-bereh/32950303.html
"Синєгубов: через удар РФ по Вовчанській громаді 6 поранених, більшість – середньої тяжкості","28-річний лікар-інтерн Бугаївської лікарні у важкому стані, решта, включаючи голову Вовчанської МВА – у середньому","17:39, 16 травня 2024",https://www.radiosvoboda.org/a/news-syniehubov-selo-vovchanska-hromada-poraneni/32950290.html
У ДТЕК повідомили про стабілізаційні відключення світла у чотирьох областях України,"У Києві, Київській, Дніпропетровській, Донецькій та Одеській областях з 16:00 діятимуть стабілізаційні відключення світла","17:23, 16 травня 2024",https://www.radiosvoboda.org/a/news-vidklyuchennya-svitla-dtek/32950264.html
МЗС Данії анонсує новий пакет допомоги Україні на понад 800 мільйонів доларів,"Расмуссен додав, що уряд Данії також резервує більше коштів для можливих подальших інвестицій в оборонну промисловість України","17:13, 16 травня 2024",https://www.radiosvoboda.org/a/news-daniia-novyi-paket-dopomohy/32950254.html
"Зеленський ветував закон, який зобов’язує звітувати про «зв’язки» з людьми в окупації",Закон дозволяє розірвати з працівником підприємства критичної інфраструктури трудовий договір за зв’язок з державою-агресором,"17:03, 16 травня 2024",https://www.radiosvoboda.org/a/news-veto-pratsivnyky-zvyazok-zvilnyty/32950238.html
"Росія не зможе окупувати Харків, якщо будуть дві системи Patriot – Зеленський","Глава держави наголосив, що «допомога нам потрібна зараз»","16:46, 16 травня 2024",https://www.radiosvoboda.org/a/news-zelenskyy-ppo-kharkiv-viyna-dopomoha-rosiya/32950212.html
Нова коаліція в Нідерландах планує продовжити підтримувати Україну,"«Нідерланди продовжать підтримувати Україну політично, у військовому, фінансовому та моральному плані проти російської агресії», – йдеться в документі","16:44, 16 травня 2024",https://www.radiosvoboda.org/a/news-niderlandy-nova-koalitsia-pidtrymka-ukrainy/32950210.html
"ОВА: війська РФ атакували касетними боєприпасами Харківщину, поранено керівника Вовчанської МВА",Пʼятеро людей постраждали,"16:23, 16 травня 2024",https://www.radiosvoboda.org/a/news-kasetni-boyeprypasy-vovchansk/32950176.html
"У Нацгвардії кажуть, що відбили наступ армії Росії у районі Липців","Відомо, що бійці «Хартії» вдарили з реактивної системи залпового вогню «по зосередженню ворожої піхоти»","16:18, 16 травня 2024",https://www.radiosvoboda.org/a/news-nats-hvardiya-lyptsi-nastup-zsu-rosiya/32950167.html
Розстріл військовими РФ чоловіка з інвалідністю у Вовчанську – прокуратура відкрила справу,"Правоохоронці припускають, що чоловік намагався відʼїхати від лікарні, але військові РФ «розстріляли його та кинули у кріслі колісному посеред вулиці»","23:12, 17 травня 2024",https://www.radiosvoboda.org/a/news-rozstril-tsyvilnyi-vovchansk/32952094.html
"Росія: у Санкт-Петербурзі пролунав вибух в Академії зв’язку, є постраждалі","На вибух відреагував губернатор Санкт-Петербургу та зазначив, що «подія не має терористичного характеру»","23:03, 17 травня 2024",https://www.radiosvoboda.org/a/news-sankt-peterburh-vybukh-rosiya/32952087.html
Генштаб: Збройні сили посилюють оборону у прикордонні Харківщини,Штаб повідомляє про шість бойових зіткнень на Куп’янському напрямку і 14 – на Краматорському напрямку,"22:39, 17 травня 2024",https://www.radiosvoboda.org/a/news-szu-oborona-kharkivshchyna/32952081.html
ОГП: в Україні цьогоріч заблокували 600 сайтів із нелегальними онлайн-казино,"«Серед нещодавно викритих правоохоронцями – підпільна зала в елітному житловому комплексі Києва, де вилучено понад 50 гральних автоматів; мережа підпільних покер-клубів у Києві, Одесі та Харкові»","22:18, 17 травня 2024",https://www.radiosvoboda.org/a/news-onlayn-kazyno-prokuratura-pravookhorontsi/32952074.html
У Празі відбувся показ фільму Крим.Реалії «Тиха депортація» про тиск Росії на кримських татар,"«Цей вражаючий документальний фільм розповідає про долю шести кримських татар, розкиданих по різних куточках Європи та окупованому Криму»","22:04, 17 травня 2024",https://www.radiosvoboda.org/a/news-praha-pokaz-tyha-deportatsiia/32952065.html
«Не бачу проблеми оновити дані» – Подоляк про чоловіків за кордоном і бронювання держслужбовців,"На питання про те, коли він востаннє відвідував ТЦК, радник Офісу президента сказав, що планує це зробити, адже закон передбачає на це 60 днів","21:38, 17 травня 2024",https://www.radiosvoboda.org/a/news-radnyk-op-choloviky-za-kordonom/32952046.html
Внаслідок обстрілу села під Херсоном поранено начальника адміністрації – влада,"«Він отримав поранення грудної клітини, руки та ноги. «Швидка» доставляє травмованого до лікарні»","21:32, 17 травня 2024",https://www.radiosvoboda.org/a/news-khersonshchyna-obstril-rosiya-viyna/32952043.html
"Терехов: через обстріл Харкова 28 людей постраждали, троє загинули","Перед тим мер міста повідомив, що двох людей вдалося врятувати","21:08, 17 травня 2024",https://www.radiosvoboda.org/a/news-terehov-kharkiv-zahybli-postrazhdali/32952027.html
«Хочемо врятувати людські життя»: Умєров щодо ситуації на Харківському фронті,Російські сили зранку 10 травня розпочали наступальні дії в Харківській області уздовж українсько-російського кордону,"21:07, 17 травня 2024",https://www.radiosvoboda.org/a/news-umyerov-kharkivshchyna-viyna-rosiya/32952026.html
Представник уряду у Раді заявив про звільнення трьох заступників Кубракова,"Раніше Верховна Рада звільнила Олександра Кубракова з посади  міністра розвитку громад, територій та інфраструктури","20:49, 17 травня 2024",https://www.radiosvoboda.org/a/news-kubrakov-zastupnyky-zvilnennya/32952014.html
Зеленський закликав до раціонального енергоспоживання на тлі підготовки до опалювального сезону,"«Має бути повне інформування суспільства про те, як відбуваються зараз відключення електрики», заявив президент","20:43, 17 травня 2024",https://www.radiosvoboda.org/a/news-zelensky-enerhospozhyvannia/32952013.html
"Прокуратура: в Києві сталась ДТП за участю трьох автівок, загинула 1,5-річна дитина","У прокуратурі кажуть, що водія BMW затримали в порядку ст. 208 КПК України. Йому готується повідомлення про підозру","20:32, 17 травня 2024",https://www.radiosvoboda.org/a/news-kyyiv-dtp-prokuratura-avariya-dytyna/32952007.html
«Укренерго»: завтра графіки відключень діятимуть лише для промисловості,Обмеження для побутових споживачів не прогнозуються,"20:21, 17 травня 2024",https://www.radiosvoboda.org/a/news-ukrenerho-vidklyuchennya-svitla/32951997.html
"Подоляк: Україна «має цифри» щодо чоловіків, які виїхали за кордон та не повернулися","«Всі цифри маємо, але вони постійно уточнюються з урахуванням того, що треба постійно проводити аналіз»","20:05, 17 травня 2024",https://www.radiosvoboda.org/a/news-podoliak-tsyfry-choloviky-za-kordonom/32951983.html
Україна та Словенія підпишуть двосторонню безпекову угоду – Зеленський,Прем’єр Словенії підтвердив його участь в саміті миру у Швейцарії,"19:59, 17 травня 2024",https://www.radiosvoboda.org/a/news-ukrayina-sloveniya-bezpekova-uhoda/32951978.html
Велика Британія запровадила санкції проти двох російських компаній,"ТБК опинилася під санкціями за те, що дозволяли судам, які займаються перевалкою нафти до КНДР, бункерувати в російському порту Східний","19:47, 17 травня 2024",https://www.radiosvoboda.org/a/news-brytaniia-sanktsii-rosiiski-kompanii/32951969.html
Терехов: у Харкові до 25 зросла кількість поранених унаслідок російського авіаудару,"Російська армія вдарила по Харкову, двома керованими авіабомбами","19:25, 17 травня 2024",https://www.radiosvoboda.org/a/news-kharkiv-aviaudar-poraneni/32951942.html
МЗС відновлює надання консульських послуг для чоловіків за кордоном,Для консульських послуг чоловіки мають подати свій військово-обліковий документ у паперовому (ВОД) або електронному вигляді (е-ВОД),"19:03, 17 травня 2024",https://www.radiosvoboda.org/a/news-konsulski-posluhy-choloviky-za-kordonom/32951916.html
"Через російську атаку на Одещині 8 поранених, є загиблий – ОВА","«Троє людей з пораненнями ушпиталені, ще двом допомога була надана на місці», повідомив голова області","19:02, 17 травня 2024",https://www.radiosvoboda.org/a/news-rosiiska-ataka-odeshchyna-pyatero-poranenyh/32951913.html
"Прокуратура повідомляє про арешт американця, якого у США підозрюють у вбивстві","За твердженням відомства, підозрюваний переховувався, але 16 травня співробітники Нацполіції затримали його в Шевченківському районі столиці","18:33, 17 травня 2024",https://www.radiosvoboda.org/a/news-prokuratura-aresht-amerykanets-pidozra-vbyvstvo/32951880.html
Авіаудар РФ по Харкову: кількість поранених зросла до 19 – влада,Чотири людини у важкому стані,"18:24, 17 травня 2024",https://www.radiosvoboda.org/a/news-kharkiv-aviaudar-obstril/32951871.html
ОВА: унаслідок російської атаки у Красногорівці загинуло троє людей,Також поранення отримав житель Часового Яру і одна людина у Багатирі Великоновосілківської громади,"18:03, 17 травня 2024",https://www.radiosvoboda.org/a/news-krasnohorivka-obstril-zahyblyy/32951826.html
Розслідувач New York Times: удар по аеродрому Бельбек знищив три винищувачі Росії,"Проаналізувавши знімки, Тріберт дійшов висновку, що атака повністю знищила два літаки Міг-31 та один Су-27, а Міг-29 пошкоджено","17:56, 17 травня 2024",https://www.radiosvoboda.org/a/news-nyt-aerodrom-belbek-vynyshchuvachi/32951824.html
"Війська РФ атакували Одесу ракетами, влада повідомляє про поранених",Близько 16.30 Повітряні сили ЗСУ попередили про рух трьох ракет у напрямку Одеси,"17:39, 17 травня 2024",https://www.radiosvoboda.org/a/news-odesa-raketna-ataka/32951805.html
Польща посилює американську присутність. Поблизу Кракова відкрили базу спеціальних сил США,"Базу відкрили на постійній основі. Відомо, що там перебуватиме 150-200 американських солдатів","17:24, 17 травня 2024",https://www.radiosvoboda.org/a/news-krakiv-viyskova-baza-ssha/32951780.html
Удар Росії по Харкову: відомо про 2 загиблих і 13 поранених,"«Серед 13 поранених, четверо – у важкому стані», – додав Синєгубов","17:21, 17 травня 2024",https://www.radiosvoboda.org/a/news-udar-rosii-kharkiv-zahybli-poraneni/32951776.html
Дрони та генератори: Міноборони Литви повідомило про пакет допомоги Україні,"Як заявив представник Міноборони, Литва зобов’язується виділити 0,25% ВВП на допомогу Україні","17:00, 17 травня 2024",https://www.radiosvoboda.org/a/news-minoborony-lytvy-dopomoha-ukraini/32951750.html
Махінації у вугільній сфері на понад 2 мільярди гривень: у ДБР повідомили про викриття схеми,"Станом на зараз заборгованість за послуги з видобутку вугілля сягають понад 2,2 мільярда гривень","16:54, 17 травня 2024",https://www.radiosvoboda.org/a/news-krasnolymanske-vuhillya-zbytky/32951745.html
Рада ЄС зупинила роботу чотирьох російських ЗМІ на території Євросоюзу – через пропаганду,"Офіційна представниця МЗС РФ Марія Захарова заявила, що Росія «відповість» на таке рішення ЄС, «заходи опрацьовуються»","16:53, 17 травня 2024",https://www.radiosvoboda.org/a/news-rada-es-zupynyla-robotu-4-zmi-rf/32951744.html
У Молдову на навчання прибули військові США – посольство,"«Сполучені Штати пишаються своєю співпрацею з урядом і народом Молдови в прагненні до створення демократичного, процвітаючого і безпечного майбутнього»","23:13, 18 травня 2024",https://www.radiosvoboda.org/a/news-moldova-litak-ssha-posolstvo/32953036.html
"У Пентагоні розповіли, коли відбудеться наступне засідання «Рамштайну»",Засідання формату «Рамштайн» з Пентагону проведуть міністр оборони США Ллойд Остін і голова Об’єднаного комітету начальників штабів генерал Чарльз Браун,"22:28, 18 травня 2024",https://www.radiosvoboda.org/a/news-pentahon-ramshtayn-ssha-zasidannya-ukrayina/32953027.html
ЗСУ відбили штурм Часового Яру – Зеленський,"«Наші воїни знищили понад 20 одиниць броньованої техніки окупанта. Молодці, хлопці»","22:10, 18 травня 2024",https://www.radiosvoboda.org/a/news-zelenskyy-viyna-chasiv-yar-donechchyna/32953024.html
З-поміж 77 бойових зіткнень за добу сім ще тривають – зведення Генштабу ЗСУ,"Відомо, що на Харківському напрямку протягом доби відбувалося 10 боєзіткнень","21:26, 18 травня 2024",https://www.radiosvoboda.org/a/news-henshtab-zsu-viyna-front-rosiya/32953016.html
На Донеччині Сили оборони збили російський штурмовик Су-25,"«Це четвертий ворожий літак, збитий бійцями цієї бригади за останні два тижні»","20:44, 18 травня 2024",https://www.radiosvoboda.org/a/news-donechchyna-vynyshchuvach-rosiya-zbyttya-su-25/32953005.html
