id,author,title,number_of_comments,created_time,post_text
3dwp71,ProxMox,When a lee sin Q's you under tower.,1,2015-07-20 04:03:08+00:00,
2mcqk6,ProxMox,225x8 squat form check,2,2014-11-15 04:33:45+00:00,
2ipt7w,ProxMox,Thought this hype up moment right before Chris Duffin's 4x BW 881lb squat was pretty funny,1,2014-10-09 00:58:32+00:00,
2ep40d,ProxMox,Twitch is back up,0,2014-08-27 04:31:25+00:00,
2e59yk,ProxMox,Form Check Squat 225x4,17,2014-08-21 03:10:00+00:00,
2e58n5,ProxMox,Form Check Squat 225x4,1,2014-08-21 02:55:41+00:00,
27vyn1,ProxMox,Can someone remind me who Mace was. Was it he the leader white walker dude on the horse?,1,2014-06-11 16:32:17+00:00,
1vm74w,ProxMox,"I just finished the second to last episode, this accurately depicts how i felt.",11,2014-01-19 20:48:06+00:00,
1si5qc,ProxMox,"If me and my friend have a server, will it get reset with this upcoming reset",3,2013-12-09 23:58:05+00:00,
1kduq8,ProxMox,(PayDay 2) The awesome part of doing a bank heist stealthy,3,2013-08-14 23:46:02+00:00,
1irzyc,ProxMox,Most beautiful moment in movie history,0,2013-07-21 23:27:48+00:00,
1gl623,ProxMox,"Rewatched The Avengers, and this has to be my favorite scene by far",0,2013-06-18 15:06:11+00:00,
1gj1sk,ProxMox,Seems like my opinion isn't widely shared here,3,2013-06-17 17:59:21+00:00,
1dwqdx,ProxMox,Few hours of leveling herbalism from 1-500 (sorry for gold hover over),1,2013-05-08 03:04:59+00:00,
1du1t0,ProxMox,"So apparently Chris Pratt has been getting a bit bulk for his role in Guardians of the Galaxy, meh",1,2013-05-07 01:49:21+00:00,
1dnnyp,ProxMox,"TIL Ron's ex-wife Tammy in Parks and Rec. is actually his wife in real life, (look at spouse)",0,2013-05-04 02:03:59+00:00,
1dcw3r,ProxMox,"Just started watching Parks and Recreation, favorite scene so far.",0,2013-04-29 19:38:58+00:00,
1cs25v,ProxMox,"Saw the post about leveling tanks, thought i'd mention hunters.",0,2013-04-21 02:41:37+00:00,
1cs22o,ProxMox,Half Hill in a nutshell.,20,2013-04-21 02:40:12+00:00,
1cs1yu,ProxMox,Why don't the Stamina and Agility stack?,2,2013-04-21 02:38:47+00:00,
1bpms3,ProxMox,Thought this could help out with new lvl 90's looking for the daily quests,12,2013-04-05 03:42:47+00:00,
1a44no,ProxMox,So we decided to pile on the Honeydew portal and use it just as our server was to shut down...,2,2013-03-11 23:53:27+00:00,
194toq,ProxMox,I've prepared for the downvotes.,4,2013-02-24 14:58:01+00:00,
15pibx,ProxMox,TIL Steven Yeun (Glenn Walking Dead) voiced korean soldeirs in Crysis,3,2012-12-31 04:37:10+00:00,
13hkv3,ProxMox,The Mighty Thirsty,1,2012-11-20 02:56:16+00:00,
10jefg,ProxMox,Is it just me or did they change the reddit alien in the tab bar?,1,2012-09-27 01:01:49+00:00,
z7jix,ProxMox,When you make eye contact with your teacher while attempting to cheat,0,2012-09-02 00:47:51+00:00,
z15r6,ProxMox,TIL Danny DeVito is 67,5,2012-08-29 18:21:05+00:00,
ytqoa,ProxMox,Being off reddit for a few hours...,2,2012-08-25 22:25:40+00:00,
vg0v7,ProxMox,"Can someone help me out, i want to make a minecraft server with a few friends but dont know how too :(
",1,2012-06-22 17:43:56+00:00,
v4itf,ProxMox,How i feel as i just started watching Hell's Kitchen....,2,2012-06-16 03:33:28+00:00,
owp9t,ProxMox,"I was watching, ""The Last Action Hero"" on Netflix, same haircut, look, and uniform..... i wonder if this was on purpose.",8,2012-01-25 22:44:34+00:00,
